{
  "$schema": "https://github.com/onovich/Game-Primitives/blob/main/research/calibration-tests/continuous-action-pilot/schema/execution-artifact-0.1.0.schema.json",
  "artifact_type": "execution_result",
  "artifact_version": "0.1.0",
  "case_results": [
    {
      "case_id": "CA-R2",
      "comparison_records": [
        {
          "comparator_id": "comparator.exact-total",
          "evidence_observation_ids": [
            "obs.total-at-stop"
          ],
          "result": "different"
        }
      ],
      "execution_ids": [
        "exec.baseline.1",
        "exec.baseline.2",
        "exec.variant.1",
        "exec.variant.2"
      ],
      "execution_status": "completed",
      "invariant_results": [
        {
          "evidence_observation_ids": [
            "obs.initial-total"
          ],
          "invariant_id": "inv.initial-state",
          "status": "held"
        },
        {
          "evidence_observation_ids": [
            "obs.raw-input"
          ],
          "invariant_id": "inv.input-trace",
          "status": "held"
        },
        {
          "evidence_observation_ids": [
            "obs.operation-count"
          ],
          "invariant_id": "inv.operation-count",
          "status": "held"
        },
        {
          "evidence_observation_ids": [
            "obs.operation-identity"
          ],
          "invariant_id": "inv.operation-identity",
          "status": "held"
        },
        {
          "evidence_observation_ids": [
            "obs.stop-boundary"
          ],
          "invariant_id": "inv.stop-boundary",
          "status": "held"
        }
      ],
      "negative_control_result": null,
      "observations": [
        {
          "configuration_id": "config.baseline",
          "execution_ids": [
            "exec.baseline.1",
            "exec.baseline.2"
          ],
          "observation_id": "obs.total-at-stop",
          "value": {
            "serialized_value": "7",
            "unit": "integer",
            "value_type": "integer"
          }
        },
        {
          "configuration_id": "config.variant",
          "execution_ids": [
            "exec.variant.1",
            "exec.variant.2"
          ],
          "observation_id": "obs.total-at-stop",
          "value": {
            "serialized_value": "4",
            "unit": "integer",
            "value_type": "integer"
          }
        }
      ],
      "repeat_consistency": "consistent"
    }
  ],
  "cases": [],
  "created_at": "2026-07-26T18:59:39.400Z",
  "environments": [
    {
      "environment_id": "env.windows-powershell",
      "name": "Windows PowerShell",
      "platform": "Windows",
      "version": "5.1.26100.8875"
    }
  ],
  "execution_plan_sha256": "3c8aa2c57062fd7948716002755352717f3b98494dad1ed8c07ad7fade1a353f",
  "executions": [],
  "finished_at": "2026-07-26T18:59:39.313Z",
  "fixture_lock": {
    "artifact_id": "rehearsal-fixture",
    "path": "research/calibration-tests/continuous-action-pilot/rehearsals/rehearsal-004/fixtures/rehearsal-fixture.ps1",
    "sha256": "2eba0767afcacfe3d18573dcb6b2596262057724d644024e6d83ae9f8cb2a318"
  },
  "prediction_set_digest": "ee9cb7a52012c0925a340ce71c5ae3b47ca4f798a59e45c2b2136c0653f1c063",
  "protocol_version": "0.1.0",
  "run_id": "rehearsal-004",
  "started_at": "2026-07-26T18:59:38.538Z",
  "trace_bundle_sha256": "3fa60cf041370614305b1f62ff4499e07e39350462ff6fe277f58fe703312c65"
}
